sentence_id,sentence,length,flesch_reading_ease,flesch_kincaid_grade
222,"Experimentation with diesel and gas power continued, culminating in the German ""Flying Hamburger"" in 1933, and the influential American EMD FT in 1939.",23,17.96826087,16.46695652
223,"These successful diesel locomotives showed that diesel power was superior to steam, due to lower costs, ease of maintenance, and better reliability.",22,22.99590909,15.51727273
224,"=== Dieselization and increased competition === World War II brought great destruction to existing railroads across Europe, Asia, and Africa.",20,33.465,13.06333333
225,"France, Russia, Switzerland, and Japan were leaders in adopting widespread electrified railroads, while other nations focused primarily on dieselization.",19,18.35,15.42
226,"Trains began to face strong competition from automobiles and freight trucks in the 1930s, which greatly intensified following World War II.",21,48.54857143,11.7047619
227,"After the war, air transport also became a significant competitor for passenger trains.",13,30.94769231,12.17230769
228,"Large amounts of traffic shifted to these new forms of transportation, resulting in a widespread decline in train service, both freight and passenger.",23,51.0726087,11.84956522
229,"The first high-speed rail service was the Japanese Shinkansen, which entered service in 1964.",14,71.76785714,6.727142857
230,"The first high-speed train in the Americas was Amtrak's Acela in the United States, which entered service in 2000.",19,62.87631579,9.209473684
231,"Aside from shipping, freight rail is the most energy-efficient and least carbon-intensive way to transport goods.""",16,42.545,11.3
232,"As such, rail transport is considered an important part of achieving sustainable energy.",13,30.94769231,12.17230769
233,"Intermodal freight trains, carrying double-stack shipping containers, have since the 1970s generated significant business for railroads and gained market share from trucks.",22,30.68681818,14.44454545
234,Increased use of commuter rail has also been promoted as a means of fighting traffic congestion on highways in urban areas.,21,44.52,12.26666667
235,"== Components == === Bogies === Bogies, also known in North America as trucks, support the wheels and axles of trains.",21,55.21529412,9.781176471
236,Trucks range from just one axle to as many as four or more.,13,96.02461538,3.095384615
