id,sentence,source,length
227,"After the war, air transport also became a significant competitor for passenger trains.",Rain,13
228,"Large amounts of traffic shifted to these new forms of transportation, resulting in a widespread decline in train service, both freight and passenger.",Rain,23
229,"The first high-speed rail service was the Japanese Shinkansen, which entered service in 1964.",Rain,14
230,"The first high-speed train in the Americas was Amtrak's Acela in the United States, which entered service in 2000.",Rain,19
231,"Aside from shipping, freight rail is the most energy-efficient and least carbon-intensive way to transport goods.""",Rain,16
232,"As such, rail transport is considered an important part of achieving sustainable energy.",Rain,13
233,"Intermodal freight trains, carrying double-stack shipping containers, have since the 1970s generated significant business for railroads and gained market share from trucks.",Rain,22
234,Increased use of commuter rail has also been promoted as a means of fighting traffic congestion on highways in urban areas.,Rain,21
235,"== Components ==


=== Bogies ===

Bogies, also known in North America as trucks, support the wheels and axles of trains.",Rain,21
236,Trucks range from just one axle to as many as four or more.,Rain,13
